{
  "$schema": "https://raw.githubusercontent.com/labscommunity/intelinside/main/custom-runtimes/schema.json",
  "runtime": "llamacpp",
  "name": "Jack llama.cpp PR ingestion test",
  "repoUrl": "https://github.com/ggml-org/llama.cpp",
  "summary": "Temporary registration fixture for testing custom-runtime PR ingestion. This does not represent a modified build.",
  "notes": "Test entry requested by jackwsmth. The source is upstream llama.cpp, not a fork authored by this account. Remove the live registration after any merge test. No benchmark results are included."
}
